{
  "schema_version": "1.0",
  "run_id": "contract-run-001",
  "created_at": "2026-08-23T00:00:00Z",
  "git_commit": "0000000000000000000000000000000000000000",
  "system": {
    "engine": "neurx",
    "engine_version": "contract",
    "accelerator": "cpu-fixture",
    "accelerator_count": 1,
    "precision": "fp32"
  },
  "model": {
    "id": "fixture-model",
    "revision": "fixture-revision"
  },
  "workload": {
    "dataset": "fixture-dataset",
    "requests": 3,
    "concurrency": 1,
    "input_tokens": 8,
    "output_tokens": 4,
    "warmup_requests": 1,
    "repetitions": 3
  },
  "metrics": {
    "ttft_ms_p50": 1,
    "tpot_ms_p50": 1,
    "request_latency_ms_p99": 5,
    "output_tokens_per_second": 10,
    "requests_per_second": 2,
    "error_rate": 0
  }
}
